{
  "schema_version": 1,
  "pack_id": "pack_example01",
  "version_id": "packv_example01",
  "version": "1.0.0",
  "name": "Synthetic Pilot Pack",
  "verification": "creator-verified",
  "approved_at": "2026-09-01T00:00:00Z",
  "expires_at": "2027-09-01T00:00:00Z",
  "tested_game_build": "build-example",
  "items": [
    {
      "item_id": "item_example01",
      "source_kind": "modlock-hosted",
      "release_or_remote_id": "rel_example01",
      "file_id": "file_example01",
      "variant": "default",
      "sha256": "aaaaaaaaaaaaaaaaaaaaaaaaaaaaaaaaaaaaaaaaaaaaaaaaaaaaaaaaaaaaaaaa",
      "required": true,
      "priority": 10
    }
  ],
  "source_evidence_urls": ["https://modlock.invalid/evidence/example"],
  "extensions": {},
  "created_at": "2026-09-01T00:00:00Z"
}

